{
  "$schema": "https://json-schema.org/draft/2020-12/schema",
  "$id": "https://hiddenshield.local/contracts/offline-license/trust-policy-v1.schema.json",
  "title": "HiddenShield Offline License Trust Policy v1",
  "type": "object",
  "additionalProperties": false,
  "required": [
    "schemaVersion",
    "policyType",
    "keys",
    "licenseSchemaRange",
    "clockPolicy",
    "releaseIntegrity"
  ],
  "properties": {
    "schemaVersion": { "const": 1 },
    "policyType": { "const": "offline_license_trust_policy" },
    "keys": {
      "type": "array",
      "minItems": 1,
      "items": {
        "type": "object",
        "additionalProperties": false,
        "required": [
          "keyId",
          "algorithm",
          "publicKeyBase64Url",
          "status",
          "purposes",
          "notBefore",
          "notAfter"
        ],
        "properties": {
          "keyId": {
            "type": "string",
            "pattern": "^[a-z0-9][a-z0-9._-]{2,63}$"
          },
          "algorithm": { "const": "Ed25519" },
          "publicKeyBase64Url": {
            "type": "string",
            "pattern": "^[A-Za-z0-9_-]{43}$"
          },
          "status": {
            "enum": ["active", "verify_only", "disabled"]
          },
          "purposes": {
            "type": "array",
            "minItems": 1,
            "uniqueItems": true,
            "items": {
              "enum": ["license", "revocation"]
            }
          },
          "notBefore": {
            "type": "string",
            "format": "date-time"
          },
          "notAfter": {
            "type": "string",
            "format": "date-time"
          }
        }
      }
    },
    "licenseSchemaRange": {
      "type": "object",
      "additionalProperties": false,
      "required": ["minimum", "maximum"],
      "properties": {
        "minimum": {
          "type": "integer",
          "minimum": 1
        },
        "maximum": {
          "type": "integer",
          "minimum": 1
        }
      }
    },
    "clockPolicy": {
      "type": "object",
      "additionalProperties": false,
      "required": [
        "rollbackToleranceSeconds",
        "futureArtifactToleranceSeconds"
      ],
      "properties": {
        "rollbackToleranceSeconds": {
          "type": "integer",
          "minimum": 0,
          "maximum": 900
        },
        "futureArtifactToleranceSeconds": {
          "type": "integer",
          "minimum": 0,
          "maximum": 900
        }
      }
    },
    "releaseIntegrity": {
      "type": "object",
      "additionalProperties": false,
      "required": [
        "requireOsPackageSignature",
        "allowInProcessSelfHashAsAuthority"
      ],
      "properties": {
        "requireOsPackageSignature": { "const": true },
        "allowInProcessSelfHashAsAuthority": { "const": false }
      }
    }
  }
}
