{
  "schemaVersion": 1,
  "policyType": "offline_license_trust_policy",
  "keys": [
    {
      "keyId": "offline-internal-2026-07-16-gate",
      "algorithm": "Ed25519",
      "publicKeyBase64Url": "ME3nKcj0iLVhKleHPpP-QK0Ql8eFB2MERyTjlqYIMXE",
      "status": "active",
      "purposes": ["license", "revocation"],
      "notBefore": "2026-07-15T00:00:00Z",
      "notAfter": "2027-07-16T00:00:00Z"
    },
    {
      "keyId": "offline-internal-2026-q3-qa",
      "algorithm": "Ed25519",
      "publicKeyBase64Url": "0eTxbCnZtqslZm1q3DuSXH7mUmpydpg7zNWdZ93uAV0",
      "status": "active",
      "purposes": ["license", "revocation"],
      "notBefore": "2026-07-15T00:00:00Z",
      "notAfter": "2027-07-15T00:00:00Z"
    }
  ],
  "licenseSchemaRange": {
    "minimum": 1,
    "maximum": 1
  },
  "clockPolicy": {
    "rollbackToleranceSeconds": 300,
    "futureArtifactToleranceSeconds": 300
  },
  "releaseIntegrity": {
    "requireOsPackageSignature": true,
    "allowInProcessSelfHashAsAuthority": false
  }
}
